<?xml version="1.0" encoding="UTF-8"?>
<BioSample xmlns="http://www.ebi.ac.uk/biosamples/SampleGroupExport/1.0"
           xmlns:xsi="http://www.w3.org/2001/XMLSchema-instance"
           xsi:schemaLocation="http://www.ebi.ac.uk/biosamples/SampleGroupExport/1.0 http://www.ebi.ac.uk/biosamples/assets/xsd/v1.0/BioSDSchema.xsd"
           id="SAMEA1234" submissionCreateDate="2016-05-05T11:36:57+00:00"
           submissionUpdateDate="2016-05-05T11:36:57+00:00"
           submissionReleaseDate="2016-04-01T11:36:57+00:00"
           submissionSubmitDate="2016-04-01T11:36:57+00:00">
    <Property class="Sample Name" characteristic="false" comment="false"
              type="STRING">
        <QualifiedValue>
            <Value>Test Sample</Value>
        </QualifiedValue>
    </Property>
    <Property class="age" characteristic="false" comment="false"
              type="STRING">
        <QualifiedValue>
            <Value>3</Value>
            <Unit>year</Unit>
        </QualifiedValue>
    </Property>
    <Property class="organism" characteristic="false" comment="false"
              type="STRING">
        <QualifiedValue>
            <Value>Homo sapiens</Value>
            <TermSourceREF>
                <Name/>
                <TermSourceID>http://purl.obolibrary.org/obo/NCBITaxon_9606</TermSourceID>
            </TermSourceREF>
        </QualifiedValue>
    </Property>
    <Property class="organism part" characteristic="false"
              comment="false" type="STRING">
        <QualifiedValue>
            <Value>heart</Value>
        </QualifiedValue>
        <QualifiedValue>
            <Value>lung</Value>
        </QualifiedValue>
    </Property>
    <Property class="sex" characteristic="false" comment="false"
              type="STRING">
        <QualifiedValue>
            <Value>female</Value>
            <TermSourceREF>
                <Name/>
                <TermSourceID>http://purl.obolibrary.org/obo/PATO_0000383</TermSourceID>
            </TermSourceREF>
        </QualifiedValue>
    </Property>

    <derivedFrom>SAMD4321</derivedFrom>

    <Database>
        <Name>other</Name>
        <URI>http://www.google.com</URI>
    </Database>
</BioSample>
